id	settlement_option	captive_option_outcome	settlement_type	acting_army_faction_effect_bundle	acting_army_faction_effect_bundle_turns	target_settlement_faction_effect_bundle	target_settlement_faction_effect_bundle_turns	group	acting_army_effect_bundle	acting_army_effect_bundle_turns	tooltip	icon	base_loot	building_loot_mod	resource_transaction	uses_small_ui_template	sort_order_override	disable_gaining_action_points_for_a_turn	required_resources	resource_loot_multiplier	required_tag	required_diplomatic_stance	audio_override	allowed_building_chains	capturing_force_resource_transaction	capturing_force_resource_loot_multiplier
#culture_settlement_occupation_options_tables;5;db/culture_settlement_occupation_options_tables/rhox_nagash																										
909094	occupation_decision_colonise	none			0		0	rhox_nagash_sc_mixer_nag_nagashoccupation_decision_colonise	wh3_main_bundle_vulnerable_colonize	1	Colonise||Settle your troops.	colonise	0.0000	1.0000		false	-1	true		0.0000						0.0000
909090	occupation_decision_do_nothing	none			0		0	rhox_nagash_sc_mixer_nag_nagashoccupation_decision_do_nothing		0	Do Nothing||Leave the settlement as it stands.	desolation	0.0000	1.0000		false	-1	true		0.0000						0.0000
909095	occupation_decision_loot	enslave			0		0	rhox_nagash_sc_mixer_nag_nagashoccupation_decision_loot		0	Loot & Occupy||You gain wealth from looting, but buildings in the settlement are damaged. All captives are enslaved, [[img:icon_public_order]][[/img]]{{tr:hp_campaign_public_order_term}} is greatly reduced, and your diplomatic relations with the previous owner also suffer greatly.	loot	0.0000	1.0000		false	-1	true		0.0000						0.0000
909093	occupation_decision_occupy	kill			0		0	rhox_nagash_sc_mixer_nag_nagashoccupation_decision_occupy		0	Occupy||{{tr:occupation_decision_occupy}}	occupy	0.0000	1.0000		false	-1	true		0.0000						0.0000
909091	occupation_decision_raze_without_occupy	kill			0		0	rhox_nagash_sc_mixer_nag_nagashoccupation_decision_raze_without_occupy		0	Raze||All buildings are destroyed and the settlement is torched. The previous owners will like you a lot less.	mixer_nag_nagash_raze	100.0000	0.2000		false	-1	true		0.0000						0.0000
909096	occupation_decision_resettle	none			0		0	rhox_nagash_sc_mixer_nag_nagashoccupation_decision_resettle		0	Resettle||With no regions currently under your control, you have the option to settle your army here.	colonise	0.0000	1.0000		false	-1	true		0.0000						0.0000
909092	occupation_decision_sack	release			0		0	rhox_nagash_sc_mixer_nag_nagashoccupation_decision_sack		0	Sack||You do not capture the settlement but instead steal wealth and damage buildings. All captives are enslaved, [[img:icon_public_order]][[/img]]{{tr:hp_campaign_public_order_term}} is reduced, and the previous owners will like you a lot less.	sack	0.0000	1.0000		false	-1	true		0.0000						0.0000
